Job Title,Company,Link,Location,Work Mode,Experience,Job Type,Industry,Functional Area,Key Skills,Job Summary,Responsibilities,Requirements,Company Size
Manager - International Regulatory Lead,Amgen India,https://www.herkey.com/jobs/manager---international-regulatory-lead/173592,Hyderabad,Work From Office,10-12 Years,Full Time,Pharma/Biotech/Clinical Research,Legal/Law,International regulatory compliance • Regulatory law,9 hours ago,"The International Regulatory Lead (IRL) Manager will provide regulatory leadership & expertise for International countries for one or more Amgen products. | This role involves collaboration with various functions and local regulatory teams to | • optimize product development and regulatory approvals in International countries | • develop international regulatory strategy and provide regulatory support for in-country product registrations and life cycle management. | • Advises Global teams on regulatory implications and requirements relevant to the global clinical development, Marketing Applications plans and objectives. | • Provides regulatory direction/expertise on the international regulatory mechanisms to optimize product development (e.g. expediting FIH studies, Orphan Drug, expedited regulatory designations, regulatory reliance mechanisms, compassionate use and pediatric plans). | • Under general supervision, plans regulatory submissions (e.g. clinical trial, marketing authorization applications and lifecycle management) for products within Amgen's portfolio. | • Under general supervision, contributes to the development of international regulatory strategy documents (regulatory product filing plan, strategies, risks associated with the potential Agency outcomes and contingency planning, estimate likelihood of success) and communicates to others, as appropriate. | • Provides and maintains clinical trial and/or marketing application documentation (excluding Chemistry, Manufacturing & Controls documentation). | May author documents/redact such documents to support a regulatory filing. | • Directs development of and manages the international label submission strategy, leads the negotiation activities with cross-functional teams and is accountable for the label deviation requests and outcomes. | • Supports local regulatory teams in triaging queries from health authorities, and where appropriate, helps identify existing responses to same or similar questions, leveraging knowledge management. | • Participates as a member of the Global Regulatory Team (GRT), and various global clinical and labelling focused teams. | • Shares regulatory information and implications with the GRT and other global teams on an ongoing basis and provides advice on international considerations. | • Partners with peers to agree on product strategy including projected submission and approval time. | • Maintains regular communications with the local teams to ensure alignment on strategy and to share product development status. | • Builds effective relationships and communication paths across the global, regional and local elements of the global regulatory affairs function. | • Maintains an awareness of new and developing legislation, regulatory policy and technical regulatory guidance relating to Amgen products. | • Performs regulatory research to obtain relevant histories, precedence and other information relevant to regional product advancement. | Basic Qualifications and Experience: | • Doctorate degree OR | • Master's degree and 10+ years of relevant regional regulatory experience OR | • Bachelor's degree and 12+ years of relevant regional regulatory experience | Functional Skills: | Must-Have Skills: | • Knowledge and experience in the international regulatory environment of clinical trial applications, non-clinical and/or clinical variations to marketing authorizations and product labelling relevant for biotechnology and products | • Comprehensive knowledge of regulatory principles and understanding of regulatory activities, and how they impact other projects and/or processes | • General awareness of the registration procedures/challenges in International countries for Clinical Trial Applications, Marketing Applications and lifecycle management activities. | Good-to-Have Skills: | • Ability to resolve conflicts and develop a course of action leading to a beneficial outcome | • Cultural awareness and sensitivity to achieve results across country, regional and international borders. | Soft Skills: | • Strong communication skills, both oral and written | • Ability to understand and communicate scientific/clinical information | • Ability to work effectively with global, local and virtual teams | • High degree of initiative and self-motivation | • Planning and organizing abilities | • Ability to manage multiple priorities successfully | • Team-oriented, with a focus on achieving team goals | • Good negotiation and influencing skills. | 23 Oct 24 | 3:02 PM | You May Be... | Watch | 23 Oct 24 | 3:01 PM | Amgen Spotlight Series: Tamika Jean-Bapiste | Amgen is committed to unlocking the potential of biology for patients suffering from serious illnesses by discovering, developing, manufac... | Read More | Amgen is committed to unlocking the potential of biology for patients suffering from serious illnesses by discovering, developing, manufac... | Follow Company | Company Size | 1001-5000 employees | Mission and Values | Amgen strives to serve patie...",Not specified,1001-5000 employees
Senior Customer Service Representative,Optum,https://www.herkey.com/jobs/senior-customer-service-representative/173574,Hyderabad,Work From Office,2-5 Years,Full Time,Medical/Healthcare/Hospital,Customer Service/ Telecalling/ Back Office Operations,Customer service • Typing,9 hours ago,"• Take chat messages per day from customers who have questions about their health benefit | • Communicate online in a conversational manner that promotes dialogue and establishes rapport. | Associate must avoid poor grammar, misstatements, or lengthy explanation. | Online writing necessitates that associate have an aptitude for knowing when to apply the “dos and don’ts” of online communication | • Provide product information, use service engagement skills, and efficiently use service resources | • Technology comfort and know-how: Associate must be adept at using the Associate Workspace, other technology, and automation tools | • App, Website, and SMS savvy: Consumers who accept an engagement will have high expectations of the associate’s knowledge. | Associate will need to maintain a high level of familiarity with the digital property the consumer is using | • Read between the lines.” Visitors don’t necessarily have good writing skills and advocates may have to interpret what the visitor is really asking by responding with a clarifying question or statement | • Adapt to continual change as the department fine-tunes the messaging program | • Advocates empathize with customers’ concerns and demonstrate understanding, striving to create positive interactions and build rapport. | Maintain a healthy brand to consumer relationship that benefits member | • Adhering to company policies and procedures, ensuring compliance with guidelines related to customer interactions, data privacy, and security. | Comply with the terms and conditions of employment contract, company policies and procedures | • Advocates collaborate with colleagues, sharing insights, best practices, and resources to collectively improve customer support effectiveness and efficiency | • Comply with the terms and conditions of the employment contract, company policies and procedures, and any and all directives (such as, but not limited to, transfer and/or re-assignment to different work locations, change in teams and/or work shifts, policies in regards to flexibility of work benefits and/or work environment, alternative work arrangements, and other decisions that may arise due to the changing business environment). | The Company may adopt, vary or rescind these policies and directives in its absolute discretion and without any limitation (implied or otherwise) on its ability to do so","• Comprehensive knowledge about the company’s products or services, enabling them to provide accurate information and guidance to customers | • Proven ability to maintain a healthy brand-to-consumer relationship that benefits the consumer. | Communicate with consumers primarily through messaging | • Proven ability to advocate troubleshoot customer problems and find solutions, utilizing resources and escalating issues when necessary to ensure timely resolution. | Provide product information, use service engagement skills, and efficiently use service resources | • Proven ability to communicate effectively with customers, ensuring clarity and understanding while maintaining a professional and friendly tone. | Type at a reasonable pace,30-45 words in a minute (WPM) | 9 Aug 23 | 1:29 PM | UHG Employee Value Proposition | ForHer | Watch | Optum is a global organization delivering care, aided by technology to help millions live healthier lives. | Help us improve health outcomes... | Read More | Optum is a global organization delivering care, aided by technology to help millions live healthier lives. | Help us improve health outcomes... | Follow Company | Company Size | 10000+ employees",10000+ employees
Supervisor Customer Service,Optum,https://www.herkey.com/jobs/supervisor-customer-service/173575,Gurgaon,Work From Office,3-6 Years,Full Time,Medical/Healthcare/Hospital,Customer Service/ Telecalling/ Back Office Operations,Customer service • Chat-support • Ms office,9 hours ago,"• Drives the fulfillment of performance metrics | • Accurate and timely documentation of claims data | • Ensure accurate and timely delivery of data to Team Liaison | • Building and maintaining an effective Team environment | • Build and maintain effective relationships with internal customers (i.e. | Team Liaison, US Team | • Leads/Supervisors, Managers and Directors etc.) | • Coordinate with the Team to identify process improvement opportunities | • Monitor, measure and report Team performance metrics and implement Team incentive | programs | • Should be able to manage attrition, EWS and shrinkage | • Identifying training needs for the team deliver and facilitate trainings | • Provide updates to management on individual and group training results, therefore facilitating further improvement in training methodology / content / methods | • Partner with leadership to promote department revenue and business objectives | • Analyze and identify error trends and opportunities for defect reduction | • Analyze and develop overall improvement plans (department and individual) | • Administrative responsibilities as assigned Handles sensitive information appropriately (HIPAA) and acts in a fair and honest manner consistent with the company’s code of conduct | • Identifies trends and issues and recommend solutions | • Comply with the terms and conditions of the employment contract, company policies and procedures, and any and all directives (such as, but not limited to, transfer and/or re-assignment to different work locations, change in teams and/or work shifts, policies in regards to flexibility of work benefits and/or work environment, alternative work arrangements, and other decisions that may arise due to the changing business environment). | The Company may adopt, vary or rescind these policies and directives in its absolute discretion and without any limitation (implied or otherwise) on its ability to do so | #NTCSR","• Total experience of 3+ years, with 2+years in the role of a Team Leader on paper | • 1+ years of experience of International Voice and Chat process | • Should have ability to lead a team in an operational environment | • Open to rotational Shifts | • 365 days 24*7 process | • No Indian Holiday | • Effective communication skills both verbal and written to individuals | • Ability to do careful listening, tact and candor, two-way communication, and master a high impact communication style | • Ability to be a Self -starter who can manage multiple priorities with minimum direction solutions | • Ability to Effectively organize and lead a team of people, in cooperative processes to achieve shared outcomes | • Should have sound knowledge of MS Office | 9 Aug 23 | 1:29 PM | UHG Employee Value Proposition | ForHer | Watch | Optum is a global organization delivering care, aided by technology to help millions live healthier lives. | Help us improve health outcomes... | Read More | Optum is a global organization delivering care, aided by technology to help millions live healthier lives. | Help us improve health outcomes... | Follow Company | Company Size | 10000+ employees",10000+ employees
"Data Analyst – Power BI, Python and Alteryx",Optum,https://www.herkey.com/jobs/data-analyst--power-bi-python-and-alteryx/173578,Hyderabad,Work From Office,4-6 Years,Full Time,Medical/Healthcare/Hospital,Research/Analytics/Business Intelligence/Big data,Power bi dashboard • Data warehousing system • Ai • Machine learning+1,9 hours ago,"• Develop end-to-end dashboards by gathering business requirements in an iterative/agile model | • Collaborate with cross-functional teams and project managers from design to implementation, monitoring, and maintenance | • Design business analysis and data migration for departmental use | • Maintain and update dashboards to ensure accuracy | • Regularly review data reports to identify and resolve errors | • Analyze and collect data for various business reports | • Create insightful business reports and communicate results | • Coordinate with supervisors/clients and manage daily activities of business support and technical teams | • Build business intelligence tools, conduct analysis to identify patterns and trends, and ensure data quality using tools like Power BI, Alteryx, and Access | • Partner with stakeholders to understand data requirements and develop tools/models such as segmentation, dashboards, data visualizations, decision aids, and business case analysis | • Analyze and document requirements, evaluate, and build effective solutions | • Query data sources for analyses, detailed data profiling, and reporting | • Research complex functional data/analytical issues | • Perform source system analysis and gap analysis between source and target systems | • Comply with the terms and conditions of the employment contract, company policies and procedures, and any and all directives (such as, but not limited to, transfer and/or re-assignment to different work locations, change in teams and/or work shifts, policies in regards to flexibility of work benefits and/or work environment, alternative work arrangements, and other decisions that may arise due to the changing business environment). | The Company may adopt, vary or rescind these policies and directives in its absolute discretion and without any limitation (implied or otherwise) on its ability to do so | #Nic","• B. | Tech & equivalent | • 4+ years of relevant industry experience (Healthcare preferred) | • Experience developing Power BI dashboards and transitioning work | • Experience in requirements gathering and data warehousing systems analysis | • Solid understanding of AI, machine learning, and modern techniques (e.g., Python) | • Proficient in VBA, SQL, Access, Power BI, Python and Alteryx | • Solid skills in process support, automation, and business insights | • Ability to organize data, recognize trends, and develop innovative approaches | • Analytical skills for data-driven report development | • Time management and project prioritization skills | • Proven solid written and verbal communication skills | • Proven excellent critical thinking and attention to detail | • General knowledge of business operations and information flow | 9 Aug 23 | 1:29 PM | UHG Employee Value Proposition | ForHer | Watch | Optum is a global organization delivering care, aided by technology to help millions live healthier lives. | Help us improve health outcomes... | Read More | Optum is a global organization delivering care, aided by technology to help millions live healthier lives. | Help us improve health outcomes... | Follow Company | Company Size | 10000+ employees",10000+ employees
Senior Customer Service Representative,Optum,https://www.herkey.com/jobs/senior-customer-service-representative/173573,Gurgaon,Work From Office,0-2 Years,Full Time,Medical/Healthcare/Hospital,Customer Service/ Telecalling/ Back Office Operations,Customer service • Business operations,9 hours ago,"• Take chat messages per day from customers who have questions about their health benefits | • Support secure email inquiries | • Use personality and our tools to help customers through the health care benefits available to them | • Communicate online in a conversational manner that promotes dialogue and establishes rapport. | Associate must avoid poor grammar, misstatements, or lengthy explanation. | Online writing necessitates that associate have an aptitude for knowing when to apply the “dos and don’ts” of online communication | • Type at a reasonable pace, 30-35 words a minute (WPM) | • Provide product information, use service engagement skills, and efficiently use service resources | • Technology comfort and know-how: Associate must be adept at using the Associate Workspace, other technology, and automation tools | • App, Website, and SMS savvy: Consumers who accept an engagement will have high expectations of the associate’s knowledge. | Associate will need to maintain a high level of familiarity with the digital property the consumer is using | • Read between the lines.” Visitors don’t necessarily have good writing skills and advocates may have to interpret what the visitor is really asking by responding with a clarifying question or statement | • Adapt to continual change as the department fine-tunes the messaging program | • Maintain a healthy brand-to-consumer relationship that benefits the consumer. | Communicate with consumers primarily through messaging. | Unlike other forms of communication, messaging grants both you and the consumer time flexibility, and keeps you connected even after the immediate question has been answered. | The result is a superior customer service experience for the consumer, and a superior professional experience for you – where you can personalize your interactions and have a meaningful impact on our business | • Comply with the terms and conditions of the employment contract, company policies and procedures, and any and all directives (such as, but not limited to, transfer and/or re-assignment to different work locations, change in teams and/or work shifts, policies in regards to flexibility of work benefits and/or work environment, alternative work arrangements, and other decisions that may arise due to the changing business environment). | The Company may adopt, vary or rescind these policies and directives in its absolute discretion and without any limitation (implied or otherwise) on its ability to do so","• Any Graduate (BBA/BCA/BA) | • Overall 6 months to 2 years of experience | • 6 months of international experience voice and Chat process | • General knowledge of computers and business operations | • Proven ability to communicate articulately and credibly | • Solid keyboard skills and experience using helpdesk, ordering or CRM software | • Demonstrated ability to achieve service goals | • Success in highly automated environment | • Dynamic and engaging written communication style | • Proven excellent interpersonal and business communications skills – verbal and written | • Demonstrated self-motivation | • Customer Service Experience | • Sales or account management experience | • Health Care/Insurance environment (familiarity with medical terminology, health plan documents, or benefit plan design) | • Social work, behavioral health, disease prevention, health promotion and behavior change (working with vulnerable populations) | 9 Aug 23 | 1:29 PM | UHG Employee Value Proposition | ForHer | Watch | Optum is a global organization delivering care, aided by technology to help millions live healthier lives. | Help us improve health outcomes... | Read More | Optum is a global organization delivering care, aided by technology to help millions live healthier lives. | Help us improve health outcomes... | Follow Company | Company Size | 10000+ employees",10000+ employees
