Job Title,Company,Link,Location,Work Mode,Experience,Job Type,Industry,Functional Area,Key Skills,Job Summary,Responsibilities,Requirements,Company Size
Analyst II - IT Solutions,Cencora,https://www.herkey.com/jobs/analyst-ii---it-solutions/173716,Pune,Work From Office,3-5 Years,Full Time,Medical/Healthcare/Hospital,Software Development,Data visualization • Bi tools • Qlik view • Tableau+1,9 hours ago,"Job DescriptionJob Description | Job Description | Requires strong technical Business Analysis skills - communication, documentation, requirements gathering, user story, Data visualization Tools experience (Qlik, PowerBI, etc). | Experience with MS SQL. | Position Summary: | Data Visualization Specialist - DVS II role is responsible for business analysis, functional design, and quality assurance activities in building out data & analytical solutions and supporting IT projects. | Data Visualization Specialists are responsible for turning abstract information from data analyses into appealing and understandable visualizations that improve business insights from the results of the analyses. | They are creative thinkers who understand user interface design and apply visualizations skills such as user experience design, data visualization and graphical design. | Individuals in this role understand how information is turned into knowledge and how this knowledge supports and enables key business processes. | They must have a good understanding of data access requirements for business analytics and exploration. | Also required are analytical skills, the ability to establish and maintain effective working relationships with team members, as well as an innate curiosity around wanting to understand business processes, business strategy and strategic business initiatives to help drive incremental business value from enterprise data assets. | • Assesses client needs utilizing a structured requirements process (gathering, analyzing, documenting, and managing changes) to assist in identifying business priorities and advice on options | • Provides experienced services including defining requirements, developing and/or maintaining computer applications/systems to meet client’s needs | • Takes accountability for end-to-end implementation and realization of the use of a variety of IT solutions by working with staff, contractors, and vendors | • Works with other team members and business stakeholders to drive development of business analytics requirements. | • Leverages knowledge of business processes and data domain. | • Brings deep expertise in data visualization tools and techniques in translating business analytics needs into data visualization and semantic data access requirements. | • Works with data engineers to facilitate technical design of complex data sourcing, transformation and aggregation logic, ensuring business analytics requirements are met | Conceptualize, design and develop data visualization solutions that synthesize data concepts into clear communications for key business stakeholders. | • Drive adoption of data and insights-driven business decision making processes and analytics-enabled business process innovation. | • Collaborate with data engineers and analytics and subject matter experts to identify useful and strategically relevant insights. | • Demonstrate a strong sense of visual design and interest in creative visualization work. | • Assist in developing best practices for data presentation and sharing across the organization. | • Demonstrate an ability to know and understand the audience and the information the audience needs. | • Demonstrate an ability to reduce data to the bare minimum of what is needed to optimally communicate a message. | • Demonstrate a drive to learn new tools and new ways of visualizing/displaying data and insights. | • Leverages data to tell the story of current performance and highlight opportunities for improvement, influencing senior leaders to act based on analytical insights | • Develops, writes, and communicates business requirements and functional specifications for the implementation of business solutions | • Supports various reporting and analytical functions necessary for the accurate maintenance of the solutions | • Identifies, pursues, and closes engagements for solutions practice and helps troubleshoot issues that arise from translation of requirements | • Analyzes customer’s operations to understand their strengths and weaknesses to determine opportunities for improvements | • Supports in review and approve test plans and monitors testing process to ensure that business results are adequately tested with minimal risk | • Keeps stakeholders informed of problems, issues, and resolutions and manages their expectations | • Works in close collaboration with business partners and developers to ensure consistent understanding of business processes and requirements | • Interacts with IT staff including business area management, portfolio managers, vendors, consultants, and other contractors | • Supports project planning and coordination among different project teams | • Partners internally with business partners, and externally with Clients elicit business requirements that describe the desired the technical/analytical solution | • Develops and authors user stories (and business cases) applying generally accepted techniques to convey the expectation | • May participate in the evaluation of visualization tools and perform research on best practices. | • May participate in POC projects and develop business analytics solutions recommendations.","Certified Business Analysis Professional (CBAP) | Skills & Knowledge: | Behavioral Skills: | Critical Thinking | Detail Oriented | Collaboration | Multitasking | Problem Solving | Technical Skills: | Data Security | Database Management Systems | Server Technologies | Software Design and Testing | Technical Documentation | Tools Knowledge: | Microsoft Office Suite | Business Intelligence Tools like Tableau, Power BI | Additional Job DescriptionAdditional Job Description | Bachelor’s degree in computer science, Information Technology or any other related discipline or equivalent related experience. | Preferred Certifications: | Certified Business Analysis Professional (CBAP)WORK EXPERIENCE: | 3-5 years of experience in developing business analytics solutions, focusing on requirements gathering and effective visualization of insights.3-5 Years of experience with data visualization/BI tools, such as Qlik or Tableau3-5 Years of experience with SQL and semantic data access mechanismsKnowledge and understanding of Datawarehouse/Datamart techniquesSKILLS & KNOWLEDGE: | Critical ThinkingDetail OrientedImpact and InfluencingInterpersonal CommunicationMultitaskingProblem SolvingTime ManagementTechnical Skills: | Application Design and ManagementBusiness Process ModellingCloud Infrastructure ManagementDatabase ManagementTechnical DocumentationNetwork Architecture and ManagementScalable Technologies & ArchitectureSoftware Development Life Cycle (SDLC)Systems IntegrationTools Knowledge: | Business Process Management (BPM) Systems like MetastormEnterprise Resource Planning (ERP) Systems like Sage, ASW, SAPJava Frameworks like JDBC, Spring, ORM Solutions, JPA, JEE, JMS, Gradle, Object Oriented DesignMicrosoft Office SuiteRelational Database Management System (RDBMS) SoftwareOperating Systems & Servers like Windows, Linux, Citrix, IBM, Oracle, SQL | Nothing to see here! Sessions in the future will show up here. | Cencora is a leading pharmaceutical solutions organization centered on improving the lives of people and animals everywhere. | <... | Read More | <... | Follow Company | Company Size | 10000+ employees | At Cencora, we’re all deeply committed to creating healthier futures, and we’re proud of it. | No matter what your role is here,... | Maternity Leave Policy | Up to 26 weeks of maternity leave based on tenure at the company and household headcount (number of children). | Paid leave of 12 weeks for adoption and surrogacy. | Paid time off for illness due to pregnancy as well as pregnancy loss. | Read Less | Child-Care Facility | Creche applicable to all India full-time female employees for keeping upto 3 children for office based team members. | Eligible for reimbursment in case of choice of other external creche facility. | Transportation Facility | Dark hour policy from 8:00 PM to 7:00 AM. | If it is dark hours and the first pick or the last drop is a female employee, a security guard would be provided in the cab. | Address | Head Office | Cencora, Pune, Maharashtra, India, 411006",10000+ employees
Senior Salesforce Developer,Cencora,https://www.herkey.com/jobs/senior-salesforce-developer/173713,Pune,Work From Office,5-8 Years,Full Time,Medical/Healthcare/Hospital,Software Development,Salesforce • Apex • Visualforce • Salesforce configuration+2,9 hours ago,"As a Senior Salesforce Developer, you will be responsible for designing, developing, and implementing Salesforce applications and solutions that align with our business objectives. | You will lead technical initiatives, mentor junior developers, and work closely with stakeholders to deliver high-quality, scalable solutions on the Salesforce platform.","Salesforce Developer certifications (e.g., Salesforce Platform Developer II, Salesforce Architect). | Experience with Salesforce Lightning Experience and Lightning Web Components (LWC). | Familiarity with DevOps practices and tools for CI/CD in Salesforce environments. | Knowledge of integration tools (e.g., MuleSoft, Informatica) and patterns. | Additional Job DescriptionAdditional Job Description | Nothing to see here! Sessions in the future will show up here. | Cencora is a leading pharmaceutical solutions organization centered on improving the lives of people and animals everywhere. | <... | Read More | <... | Follow Company | Company Size | 10000+ employees | At Cencora, we’re all deeply committed to creating healthier futures, and we’re proud of it. | No matter what your role is here,... | Maternity Leave Policy | Up to 26 weeks of maternity leave based on tenure at the company and household headcount (number of children). | Paid leave of 12 weeks for adoption and surrogacy. | Paid time off for illness due to pregnancy as well as pregnancy loss. | Read Less | Child-Care Facility | Creche applicable to all India full-time female employees for keeping upto 3 children for office based team members. | Eligible for reimbursment in case of choice of other external creche facility. | Transportation Facility | Dark hour policy from 8:00 PM to 7:00 AM. | If it is dark hours and the first pick or the last drop is a female employee, a security guard would be provided in the cab. | Address | Head Office | Cencora, Pune, Maharashtra, India, 411006",10000+ employees
Senior ABAP Developer - SAP ECC,Cencora,https://www.herkey.com/jobs/senior-abap-developer---sap-ecc/173714,Pune,Work From Office,5-8 Years,Full Time,Medical/Healthcare/Hospital,Software Development,Abap workbench • Abap objects • Sap smart forms • Adobe form designer+3,9 hours ago,Not specified,"What you will be doing | Analyzes system operations through monitoring, capacity analysis and root cause analysis to identify and drive change that ensures continuous improvement in system stability and performance. | Assists in the overall maintenance and support of the efficient software solutions. | Collaborates with technology teams across the Organization to leverage resources and expertise, establish software best practices and standards, and build for partnerships with IT teams. | Responsible for program designs, development, unit testing, peer reviews in an SAP ABAP environment. | Responsible for identifying development tasks in support of project planning and estimation. | Participates in and makes performance recommendations to code during peer reviews. | Works with functional and business users to troubleshoot issues in production. | Demonstrates knowledge of software development life cycle (SDLC), modeling of business processes, application design patterns, and business/functional documentsSupports the building and maintenance of an Enterprise portfolio to support Application capabilities lifecycle and roadmap initiatives. | Advises business areas in the analysis of innovative technologies and how they impact the broader Enterprise ArchitectureAssists in the analysis, design, and development of the business solutions. | Analyzes industry standards and trends in integration technologies. | Provides technical leadership, coaching, and mentoring to team members. | Conducts SAP unit testing to ensure systems meets user specifications. | Requires increased skill in multiple technical environments and knowledge of a specific business area. | May participate in the project planning process with team members. | May meet with process team to analyze business processes, understand requirements, and recommend technical solutions... | May analyzes existing SAP platform to identify weaknesses and develop opportunities for improvements, when assigned. | Troubleshoots existing information systems to identify errors or deficiencies and develop solutions. | Works with functional users to troubleshoot issues in production. | Troubleshoots and resolves production problems. | Escalates issues to manager and admin and process teams where necessary. | Identifies recurring and potential problems and recommends procedures and controls for prevention. | Recommends ideas for improving production support. | Documents technical design and test activities/resultsFollows established change control procedures. | Provides input to the development and maintenance of development standards for full life cycle implementations or upgrades. | Assists in evaluating new SAP application development tools. | Demonstrates knowledge of ABAP developmentAbility to communicate effectively both orally and in writingStrong mathematical and analytical skillsStrong organizational skills; attention to detailGood conceptual and problem-solving skills to evaluate business problems and apply applications knowledge to identify appropriate solutionsGood interpersonal skills; effective team playerAdditional Job DescriptionAdditional Job Description | Bachelor’s Degree in Computer Science, Information Technology or any other related discipline or equivalent related experience. | Requires training in fields such as information systems computer sciences or similar vocations obtained through completion of a four-year bachelor’s degree program; normally requires a minimum of five (5+) years directly related and progressively responsible experience designing building testing and deploying enterprise SAP solutions (certification preferred) . | In-depth experience in ABAP Workbench, ABAP Objects, BAPI, BADI’s, RFC Smart Forms, Adobe Forms, IDOCs, BDC and ALV Programming. | ABAP coding experience with a proficient understanding of work processes, dynamic coding, parallel processing, DDIC and ABAP tuning techniques. | Basic experience in SAP Fiori (on-premise and cloud) and web user interface technologies like SAPUI5, JavaScript and Web IDEFamiliarity with capabilities of SAP HANA is desired but not required for this role. | Extending existing S/4, and/or writing entirely new S/4 programs and functions , CDS tools using ABAP in Eclipse (ADT), and ABAP Managed Database Procedures (AMDP). | Application/Infrastructure/Enterprise Architect Training and Certification, e.g. | TOGAF | Skills & Knowledge: | Behavioral Skills: | Collaboration | Creativity & Innovation | Decision Making | Planning | Presentation Skills | Risk-taking | Technical Skills: | Cloud Architecture | Data Architecture & Governance | Operating Systems | Programming and Development | Application Architecture | Software Development Life Cycle (SDLC) | Tools Knowledge: | Architecture Framework tools | Programming and Development and Development Languages | Nothing to see here! Sessions in the future will show up here. | Cencora is a leading pharmaceutical solutions organization centered on improving the lives of people and animals everywhere. | <... | Read More | <... | Follow Company | Company Size | 10000+ employees | At Cencora, we’re all deeply committed to creating healthier futures, and we’re proud of it. | No matter what your role is here,... | Maternity Leave Policy | Up to 26 weeks of maternity leave based on tenure at the company and household headcount (number of children). | Paid leave of 12 weeks for adoption and surrogacy. | Paid time off for illness due to pregnancy as well as pregnancy loss. | Read Less | Child-Care Facility | Creche applicable to all India full-time female employees for keeping upto 3 children for office based team members. | Eligible for reimbursment in case of choice of other external creche facility. | Transportation Facility | Dark hour policy from 8:00 PM to 7:00 AM. | If it is dark hours and the first pick or the last drop is a female employee, a security guard would be provided in the cab. | Address | Head Office | Cencora, Pune, Maharashtra, India, 411006",10000+ employees
Manager - Software Engineer,Cencora,https://www.herkey.com/jobs/manager---software-engineer/173709,Pune,Work From Office,10-13 Years,Full Time,Medical/Healthcare/Hospital,Software Development,Blazor • Razorsql • C# • Mysql+5,9 hours ago,"Leads multiple software development projects by managing a team of Software Engineers. | Manages development activities with the goal of building the next generation of the company’s software products. | Drives development as the digital platform group moves into new market areas such as cloud computing. | Works closely with the business to build cutting-edge solutions following the agile development process. | Contributes to critical R&D software development projects that help the company innovate the technology. | Maintains and grows core toolkit that supports applications along with secondary applications. | Works with customers, the product management team, and the software development team to develop and design software. | Works in cross-functional teams and leads requirement analysis, prototyping, and delivery. | Manages, trains, develops, and mentors team members and participates in budget making process. | Facilitates the creation of detailed development plansManages the coordination between different teams involved in the development cycle. | Communicates with customers to bring clarity in product requirements and product feedback. | Manages risk identification and mitigation strategies with sprint teams. | Ensures the product delivered fulfills the expectations of the stakeholdersEnsures documentation of the processes. | Serves as a technical leader and expert providing directions across multiple sprint teams. | Brings synergies among the business needs, user requirements and team capabilities. | Additional Job DescriptionAdditional Job Description","Bachelor’s Degree in Computer Science, Information Technology or any other related discipline or equivalent related experience. | Preferred Certifications: | Cloud Architect Certifications. | Integration Architects Certifications. | Application/Infrastructure/Enterprise Architect Training and Certification, e.g. | TOGAF. | SAFe Agile Certification. | Project Management Professional (PMP) Certification. | WORK EXPERIENCE: | 10+ years of directly-related or relevant experience with 5+ years in a managerial capacity, preferably in software designing and development or systems architecture. | SKILLS & KNOWLEDGE: | Behavioral Skills: | Coaching and MentoringCollaborationConflict ResolutionCritical ThinkingDetail OrientedInterpersonal CommunicationPlanningPrioritization and OrganizationProblem SolvingTechnical Skills: | Blazor & RazorC#MySqlExperience in Leading TeamAgile Architecture Delivery. | Architecture Strategy & Framework Design. | Cloud Computing Methodologies. | Data Architecture & Governance. | Integration Testing & Validation. | Scalable Technologies & Architecture. | Software Development Life Cycle (SDLC). | Stakeholder Management. | Storyboarding. | Tools Knowledge: | Blazor & RazorC#MysqlCloud Computing Tools like AWS, Azure, Google cloud. | Container Management and Orchestration toolsMicrosoft Office Suite. - Java , HTML /CSS, JavaScript DevOpsOperating Systems & Servers like Windows, Linux, Citrix, IBM, Oracle, SQL. | Nothing to see here! Sessions in the future will show up here. | Cencora is a leading pharmaceutical solutions organization centered on improving the lives of people and animals everywhere. | <... | Read More | <... | Follow Company | Company Size | 10000+ employees | At Cencora, we’re all deeply committed to creating healthier futures, and we’re proud of it. | No matter what your role is here,... | Maternity Leave Policy | Up to 26 weeks of maternity leave based on tenure at the company and household headcount (number of children). | Paid leave of 12 weeks for adoption and surrogacy. | Paid time off for illness due to pregnancy as well as pregnancy loss. | Read Less | Child-Care Facility | Creche applicable to all India full-time female employees for keeping upto 3 children for office based team members. | Eligible for reimbursment in case of choice of other external creche facility. | Transportation Facility | Dark hour policy from 8:00 PM to 7:00 AM. | If it is dark hours and the first pick or the last drop is a female employee, a security guard would be provided in the cab. | Address | Head Office | Cencora, Pune, Maharashtra, India, 411006",10000+ employees
Engineer II - Software Engineering,Cencora,https://www.herkey.com/jobs/engineer-ii---software-engineering/173711,Pune,Work From Office,3-4 Years,Full Time,Medical/Healthcare/Hospital,Software Development,Data analytics • Data management • Ms azure • Ms sql+1,9 hours ago,"• Models and frames business scenarios that are meaningful and which impacts critical business processes and/or decisions | • Collaborates with subject matter experts to select relevant sources of information, translates business requirements into semantic access, conceptual, logical and/or physical data models • Executes data profiling and preventative procedures to improve data quality; uses technology to extract and analyze raw data • Identifies opportunities and supports the development of automated solutions that will enhance the quality of enterprise data • Codes, tests, debugs and documents complex programs, and enhances existing programs to ensure that data processing production systems continue to meet user requirements • Works to develop the specifications of customer and user specific reports including network exclusions, special circumstances, and custom data elements • Identifies complex areas to solve new technical problems and provides innovative technical solutions within data management platform | · When assigned, analyzes data platform to identify areas of improvement and provides innovative technical solutions to optimize and improve performance. | · Additional Job Description | ·","Bachelor’s degree in Computer Science, Information Technology or any other related discipline or equivalent related experience. | Preferred Certifications: • Data Analytics Certifications | • Data Management/Engineering Certifications in MS SQL, MS Azure • Any BI Tool (PowerBI, Qlik Sense, Tableau etc.) Certifications | WORK EXPERIENCE: 3-4 years of directly related or relevant experience, preferably in healthcare data analytics or data engineering/data management using cloud/on prem technologies such as MS Azure (Synapse, ADF, Logic Apps), MS SQL (SSIS, SSRS) | SKILLS & KNOWLEDGE: | Behavioral Skills: • Assertiveness | • Communication Skills (Both verbal and written) • Creativity & Innovation • Critical Thinking • Impact and Influencing • Multitasking • Prioritization and Organization | Technical Skills: • Advanced Data Visualization Techniques • Data Engineering, building data pipelines using both cloud and on prem technologies | • Building Datawarehouse/Data marts /Data Lakes • Big Data Analysis Tools and Techniques • Data Governance • Data Management • Data Modelling • Data Quality Assurance • Programming languages like SQL, R, Python | Tools Knowledge: • Data Engineering/Data Management tools like Databricks, MS Azure Synapse, ADF, Logic Apps, MS SSIS | • Business Intelligence Software like Tableau, Power BI, SAP BWHANA • Data Visualization Tools • Microsoft Office Suite | Additional Job DescriptionAdditional Job Description | Nothing to see here! Sessions in the future will show up here. | Cencora is a leading pharmaceutical solutions organization centered on improving the lives of people and animals everywhere. | <... | Read More | <... | Follow Company | Company Size | 10000+ employees | At Cencora, we’re all deeply committed to creating healthier futures, and we’re proud of it. | No matter what your role is here,... | Maternity Leave Policy | Up to 26 weeks of maternity leave based on tenure at the company and household headcount (number of children). | Paid leave of 12 weeks for adoption and surrogacy. | Paid time off for illness due to pregnancy as well as pregnancy loss. | Read Less | Child-Care Facility | Creche applicable to all India full-time female employees for keeping upto 3 children for office based team members. | Eligible for reimbursment in case of choice of other external creche facility. | Transportation Facility | Dark hour policy from 8:00 PM to 7:00 AM. | If it is dark hours and the first pick or the last drop is a female employee, a security guard would be provided in the cab. | Address | Head Office | Cencora, Pune, Maharashtra, India, 411006",10000+ employees
