Job Title,Company,Link,Location,Work Mode,Experience,Job Type,Industry,Functional Area,Key Skills,Job Summary,Responsibilities,Requirements,Company Size
HR Head,Magicians of Wellness (India) Pvt. Ltd.,https://www.herkey.com/jobs/hr-head/173732,Mumbai,Work From Office,3-5 Years,Full Time,Internet/E-Commerce/Startups,"HR - Recruiter, Admin",Hr ops • Culture mgmt • Excellent written & verbal communication skills • Cross functional teamwork+6,9 hours ago,Not specified,Not specified,1-10 employees
Data Engineer III - Data Engineering,Cencora,https://www.herkey.com/jobs/data-engineer-iii---data-engineering/173712,Pune,Work From Office,4-6 Years,Full Time,Medical/Healthcare/Hospital,Software Development,Advanced data visualization • Data pipelines • Datawarehouse • Data marts+2,9 hours ago,"• Models and frames business scenarios that are meaningful and which impacts critical business processes and/or decisions | • Collaborates with subject matter experts to select relevant sources of information, translates business requirements into semantic access, conceptual, logical and/or physical data models • Executes data profiling and preventative procedures to improve data quality; uses technology to extract and analyze raw data • Identifies opportunities and supports the development of automated solutions that will enhance the quality of enterprise data • Codes, tests, debugs and documents complex programs, and enhances existing programs to ensure that data processing production systems continue to meet user requirements • Works to develop the specifications of customer and user specific reports including network exclusions, special circumstances, and custom data elements • Identifies complex areas to solve new technical problems and provides innovative technical solutions within data management platform | · When assigned, analyzes data platform to identify areas of improvement and provides innovative technical solutions to optimize and improve performance. | · Additional Job Description | ·","Bachelor’s degree in Computer Science, Information Technology or any other related discipline or equivalent related experience. | Preferred Certifications: • Data Analytics Certifications | • Data Management/Engineering Certifications in MS Azure, Databricks etc. • Any BI Tool (PowerBI, Qlik Sense, Tableau etc.) Certifications | WORK EXPERIENCE: 4-6 years of directly related or relevant experience, preferably in healthcare data analytics or data engineering/data management using cloud/on-prem technologies such as MS Azure , (Databricks, Synapse, ADF, Logic Apps), MS SQL (SSIS, SSRS) | SKILLS & KNOWLEDGE: | Behavioral Skills: • Assertiveness | • Communication Skills (Both verbal and written) • Creativity & Innovation • Critical Thinking • Impact and Influencing • Multitasking • Prioritization and Organization | Technical Skills: • Advanced Data Visualization Techniques • Data Engineering, building data pipelines using both cloud and on prem technologies | • Building Datawarehouse/Data marts /Data Lakes • Big Data Analysis Tools and Techniques • Data Governance • Data Management • Data Modelling • Data Quality Assurance • Programming languages like SQL, R, Python | Tools Knowledge: • Data Engineering/Data Management tools like Databricks and related technologies, MS Azure Synapse, ADF, Logic Apps, MS SSIS | • Business Intelligence Software like Power BI, Tableau, QlikSense • Data Visualization Tools • Microsoft Office Suite | Additional Job DescriptionAdditional Job Description | Bachelor’s Degree in Statistics, Computer Science, Information Technology or any other related discipline or equivalent related experience. | Preferred Certifications: • Advanced Data Analytics Certifications • SAS Statistical Business Analyst Professional Certification | WORK EXPERIENCE: 4+ years of directly-related or relevant experience, preferably in healthcare data analytics or data engineering. | Behavioral Skills: • Critical Thinking • Detail Oriented • Impact and Influencing • Interpersonal Communication • Multitasking • Problem Solving • Time Management | Technical Skills: • Advanced Data Visualization Techniques • Advanced Statistical Analysis • Big Data Analysis Tools and Techniques • Data Governance • Data Management • Data Modelling • Data Quality Assurance • Programming languages like SQL, R, Python | Tools Knowledge: • Business Intelligence Software like Tableau, Power BI, Alteryx, QlikSense • Data Visualization Tools • Microsoft Office Suite • Statistical Analytics tools (SAS, SPSS3) | Nothing to see here! Sessions in the future will show up here. | Cencora is a leading pharmaceutical solutions organization centered on improving the lives of people and animals everywhere. | <... | Read More | <... | Follow Company | Company Size | 10000+ employees | At Cencora, we’re all deeply committed to creating healthier futures, and we’re proud of it. | No matter what your role is here,... | Maternity Leave Policy | Up to 26 weeks of maternity leave based on tenure at the company and household headcount (number of children). | Paid leave of 12 weeks for adoption and surrogacy. | Paid time off for illness due to pregnancy as well as pregnancy loss. | Read Less | Child-Care Facility | Creche applicable to all India full-time female employees for keeping upto 3 children for office based team members. | Eligible for reimbursment in case of choice of other external creche facility. | Transportation Facility | Dark hour policy from 8:00 PM to 7:00 AM. | If it is dark hours and the first pick or the last drop is a female employee, a security guard would be provided in the cab. | Address | Head Office | Cencora, Pune, Maharashtra, India, 411006",10000+ employees
SAP PI/PO Developer,Cencora,https://www.herkey.com/jobs/sap-pi-po-developer/173715,Pune,Work From Office,6-8 Years,Full Time,Medical/Healthcare/Hospital,Software Development,Sap netweaver • Sap pi/po • Sap abap • Java+1,9 hours ago,Not specified,"6+ years experience in design, development and support of SAP NetWeaver PI components and interfaces, including ABAP and Java development and AdeptiaAdvanced software development and architectural skills with excellent knowledge of distributed computing. | Demonstrated ability to develop and release quality products on time in an emerging technology environment. | Experience with large scale SAP implementation projects. | Experience with SAP NetWeaver, SAP PI/PO 7.x, SAP ABAP, and Java. | Working knowledge of PI message mapping techniques. | Working knowledge of FILE, JMS, JDBC, MAIL, RFC, SOAP adapters and how to setup for use, including implementing SSL on both the ABAP and JAVA stacks (require knowledge of mutual SSL). | Experience building custom PI/PO adapter modules. | Ability to monitor PI/PO for errors - alert configuration and monitoring. | Requires knowledge on PI/PO troubleshooting and the tools used for troubleshooting, as well as troubleshooting ABAP and J2EE stacks in general. | Excellent problem solving and communication skills. | Strong knowledge in Configuring APIs, proxy endpoints, API portals and API analytics. | Writing and utilizing APIs / Action Layer / MVC. | Strong knowledge in REST API development, Web service development and RAML design, connectors, and Exception Handling. | Minimum 4 years of proven experience with SAP Process Integration. | How to process large messages, as well as a large number of messages concurrently. | Working knowledge of PI/PO/CPI/APIM caches and transports. | Working knowledge of the PI/PO Advanced Adapter Engine. | Knowledge of BPE (Business Process Engine). | Ability to establish and maintain a high-level of customer trust and confidence. | CPI/APIM knowledge is a mustWorking knowledge with CI/CDWorking Knowledge with tools like postman, SOAPUI and Oxygen-xmlWorking knowledge with CTS+Additional Job DescriptionAdditional Job Description | The successful candidate should have a B. | S. degree in Computer Science, Business or related field. | This position requires 6+ years experience in design, development and support of SAP NetWeaver PI components and interfaces, including ABAP and Java development. | Application support experience with WebSphere MQ, while not a requirement, is considered a plus. | Skills & Knowledge: Behavioral Skills: Critical Thinking Detail Oriented Impact and Influencing Interpersonal Communication Multitasking Problem Solving Time Management | Nothing to see here! Sessions in the future will show up here. | Cencora is a leading pharmaceutical solutions organization centered on improving the lives of people and animals everywhere. | <... | Read More | <... | Follow Company | Company Size | 10000+ employees | At Cencora, we’re all deeply committed to creating healthier futures, and we’re proud of it. | No matter what your role is here,... | Maternity Leave Policy | Up to 26 weeks of maternity leave based on tenure at the company and household headcount (number of children). | Paid leave of 12 weeks for adoption and surrogacy. | Paid time off for illness due to pregnancy as well as pregnancy loss. | Read Less | Child-Care Facility | Creche applicable to all India full-time female employees for keeping upto 3 children for office based team members. | Eligible for reimbursment in case of choice of other external creche facility. | Transportation Facility | Dark hour policy from 8:00 PM to 7:00 AM. | If it is dark hours and the first pick or the last drop is a female employee, a security guard would be provided in the cab. | Address | Head Office | Cencora, Pune, Maharashtra, India, 411006",10000+ employees
Analyst II - IT Solutions,Cencora,https://www.herkey.com/jobs/analyst-ii---it-solutions/173716,Pune,Work From Office,3-5 Years,Full Time,Medical/Healthcare/Hospital,Software Development,Data visualization • Bi tools • Qlik view • Tableau+1,9 hours ago,"Job DescriptionJob Description | Job Description | Requires strong technical Business Analysis skills - communication, documentation, requirements gathering, user story, Data visualization Tools experience (Qlik, PowerBI, etc). | Experience with MS SQL. | Position Summary: | Data Visualization Specialist - DVS II role is responsible for business analysis, functional design, and quality assurance activities in building out data & analytical solutions and supporting IT projects. | Data Visualization Specialists are responsible for turning abstract information from data analyses into appealing and understandable visualizations that improve business insights from the results of the analyses. | They are creative thinkers who understand user interface design and apply visualizations skills such as user experience design, data visualization and graphical design. | Individuals in this role understand how information is turned into knowledge and how this knowledge supports and enables key business processes. | They must have a good understanding of data access requirements for business analytics and exploration. | Also required are analytical skills, the ability to establish and maintain effective working relationships with team members, as well as an innate curiosity around wanting to understand business processes, business strategy and strategic business initiatives to help drive incremental business value from enterprise data assets. | • Assesses client needs utilizing a structured requirements process (gathering, analyzing, documenting, and managing changes) to assist in identifying business priorities and advice on options | • Provides experienced services including defining requirements, developing and/or maintaining computer applications/systems to meet client’s needs | • Takes accountability for end-to-end implementation and realization of the use of a variety of IT solutions by working with staff, contractors, and vendors | • Works with other team members and business stakeholders to drive development of business analytics requirements. | • Leverages knowledge of business processes and data domain. | • Brings deep expertise in data visualization tools and techniques in translating business analytics needs into data visualization and semantic data access requirements. | • Works with data engineers to facilitate technical design of complex data sourcing, transformation and aggregation logic, ensuring business analytics requirements are met | Conceptualize, design and develop data visualization solutions that synthesize data concepts into clear communications for key business stakeholders. | • Drive adoption of data and insights-driven business decision making processes and analytics-enabled business process innovation. | • Collaborate with data engineers and analytics and subject matter experts to identify useful and strategically relevant insights. | • Demonstrate a strong sense of visual design and interest in creative visualization work. | • Assist in developing best practices for data presentation and sharing across the organization. | • Demonstrate an ability to know and understand the audience and the information the audience needs. | • Demonstrate an ability to reduce data to the bare minimum of what is needed to optimally communicate a message. | • Demonstrate a drive to learn new tools and new ways of visualizing/displaying data and insights. | • Leverages data to tell the story of current performance and highlight opportunities for improvement, influencing senior leaders to act based on analytical insights | • Develops, writes, and communicates business requirements and functional specifications for the implementation of business solutions | • Supports various reporting and analytical functions necessary for the accurate maintenance of the solutions | • Identifies, pursues, and closes engagements for solutions practice and helps troubleshoot issues that arise from translation of requirements | • Analyzes customer’s operations to understand their strengths and weaknesses to determine opportunities for improvements | • Supports in review and approve test plans and monitors testing process to ensure that business results are adequately tested with minimal risk | • Keeps stakeholders informed of problems, issues, and resolutions and manages their expectations | • Works in close collaboration with business partners and developers to ensure consistent understanding of business processes and requirements | • Interacts with IT staff including business area management, portfolio managers, vendors, consultants, and other contractors | • Supports project planning and coordination among different project teams | • Partners internally with business partners, and externally with Clients elicit business requirements that describe the desired the technical/analytical solution | • Develops and authors user stories (and business cases) applying generally accepted techniques to convey the expectation | • May participate in the evaluation of visualization tools and perform research on best practices. | • May participate in POC projects and develop business analytics solutions recommendations.","Certified Business Analysis Professional (CBAP) | Skills & Knowledge: | Behavioral Skills: | Critical Thinking | Detail Oriented | Collaboration | Multitasking | Problem Solving | Technical Skills: | Data Security | Database Management Systems | Server Technologies | Software Design and Testing | Technical Documentation | Tools Knowledge: | Microsoft Office Suite | Business Intelligence Tools like Tableau, Power BI | Additional Job DescriptionAdditional Job Description | Bachelor’s degree in computer science, Information Technology or any other related discipline or equivalent related experience. | Preferred Certifications: | Certified Business Analysis Professional (CBAP)WORK EXPERIENCE: | 3-5 years of experience in developing business analytics solutions, focusing on requirements gathering and effective visualization of insights.3-5 Years of experience with data visualization/BI tools, such as Qlik or Tableau3-5 Years of experience with SQL and semantic data access mechanismsKnowledge and understanding of Datawarehouse/Datamart techniquesSKILLS & KNOWLEDGE: | Critical ThinkingDetail OrientedImpact and InfluencingInterpersonal CommunicationMultitaskingProblem SolvingTime ManagementTechnical Skills: | Application Design and ManagementBusiness Process ModellingCloud Infrastructure ManagementDatabase ManagementTechnical DocumentationNetwork Architecture and ManagementScalable Technologies & ArchitectureSoftware Development Life Cycle (SDLC)Systems IntegrationTools Knowledge: | Business Process Management (BPM) Systems like MetastormEnterprise Resource Planning (ERP) Systems like Sage, ASW, SAPJava Frameworks like JDBC, Spring, ORM Solutions, JPA, JEE, JMS, Gradle, Object Oriented DesignMicrosoft Office SuiteRelational Database Management System (RDBMS) SoftwareOperating Systems & Servers like Windows, Linux, Citrix, IBM, Oracle, SQL | Nothing to see here! Sessions in the future will show up here. | Cencora is a leading pharmaceutical solutions organization centered on improving the lives of people and animals everywhere. | <... | Read More | <... | Follow Company | Company Size | 10000+ employees | At Cencora, we’re all deeply committed to creating healthier futures, and we’re proud of it. | No matter what your role is here,... | Maternity Leave Policy | Up to 26 weeks of maternity leave based on tenure at the company and household headcount (number of children). | Paid leave of 12 weeks for adoption and surrogacy. | Paid time off for illness due to pregnancy as well as pregnancy loss. | Read Less | Child-Care Facility | Creche applicable to all India full-time female employees for keeping upto 3 children for office based team members. | Eligible for reimbursment in case of choice of other external creche facility. | Transportation Facility | Dark hour policy from 8:00 PM to 7:00 AM. | If it is dark hours and the first pick or the last drop is a female employee, a security guard would be provided in the cab. | Address | Head Office | Cencora, Pune, Maharashtra, India, 411006",10000+ employees
Senior Salesforce Developer,Cencora,https://www.herkey.com/jobs/senior-salesforce-developer/173713,Pune,Work From Office,5-8 Years,Full Time,Medical/Healthcare/Hospital,Software Development,Salesforce • Apex • Visualforce • Salesforce configuration+2,9 hours ago,"As a Senior Salesforce Developer, you will be responsible for designing, developing, and implementing Salesforce applications and solutions that align with our business objectives. | You will lead technical initiatives, mentor junior developers, and work closely with stakeholders to deliver high-quality, scalable solutions on the Salesforce platform.","Salesforce Developer certifications (e.g., Salesforce Platform Developer II, Salesforce Architect). | Experience with Salesforce Lightning Experience and Lightning Web Components (LWC). | Familiarity with DevOps practices and tools for CI/CD in Salesforce environments. | Knowledge of integration tools (e.g., MuleSoft, Informatica) and patterns. | Additional Job DescriptionAdditional Job Description | Nothing to see here! Sessions in the future will show up here. | Cencora is a leading pharmaceutical solutions organization centered on improving the lives of people and animals everywhere. | <... | Read More | <... | Follow Company | Company Size | 10000+ employees | At Cencora, we’re all deeply committed to creating healthier futures, and we’re proud of it. | No matter what your role is here,... | Maternity Leave Policy | Up to 26 weeks of maternity leave based on tenure at the company and household headcount (number of children). | Paid leave of 12 weeks for adoption and surrogacy. | Paid time off for illness due to pregnancy as well as pregnancy loss. | Read Less | Child-Care Facility | Creche applicable to all India full-time female employees for keeping upto 3 children for office based team members. | Eligible for reimbursment in case of choice of other external creche facility. | Transportation Facility | Dark hour policy from 8:00 PM to 7:00 AM. | If it is dark hours and the first pick or the last drop is a female employee, a security guard would be provided in the cab. | Address | Head Office | Cencora, Pune, Maharashtra, India, 411006",10000+ employees
